[
  {
    "name": "List 1",
    "labels": {
      "en": "List 1",
      "de": "Liste 1"
    },
    "comments": {
      "en": "Comments List",
      "de": "Kommentar Liste"
    },
    "nodes": [
      {
        "name": "List 1:Node 1",
        "labels": {
          "de": "Knoten 1",
          "en": "Node 1"
        },
        "nodes": [
          {
            "name": "Node 1.1",
            "labels": {
              "de": "Knoten 1.1",
              "en": "Node 1.1"
            },
            "nodes": [
              {
                "name": "custom_name_1-1-1",
                "labels": {
                  "de": "Knoten 1.1.1",
                  "en": "Node 1.1.1"
                }
              },
              {
                "name": "custom_name_1-1-2",
                "labels": {
                  "de": "Knoten 1.1.2",
                  "en": "Node 1.1.2"
                }
              }
            ]
          }
        ]
      },
      {
        "name": "List 1:Node 2",
        "labels": {
          "de": "Knoten 2",
          "en": "Node 2"
        },
        "nodes": [
          {
            "name": "Node 2.1",
            "labels": {
              "de": "Knoten 2.1",
              "en": "Node 2.1"
            },
            "comments": {
              "de": "Kommentar N2.1",
              "en": "Comments N2.1"
            }
          },
          {
            "name": "Node 2.2",
            "labels": {
              "de": "Knoten 2.2",
              "en": "Node 2.2"
            }
          },
          {
            "name": "Node 2.3",
            "labels": {
              "de": "Knoten 2.3",
              "en": "Node 2.3"
            }
          }
        ]
      },
      {
        "name": "List 1:Node 3",
        "labels": {
          "de": "Knoten 3",
          "en": "Node 3"
        },
        "comments": {
          "de": "Kommentar N3",
          "en": "Comments N3"
        }
      }
    ]
  },
  {
    "name": "List 2",
    "labels": {
      "en": "List 2"
    },
    "comments": {
      "en": "Comment List"
    },
    "nodes": [
      {
        "name": "List 2:Node 1",
        "labels": {
          "en": "Node 1"
        },
        "comments": {
          "en": "Comment N1"
        },
        "nodes": [
          {
            "name": "List 2:Node 1:subnode1",
            "labels": {
              "en": "subnode1"
            },
            "comments": {
              "en": "Comment N1.1"
            }
          }
        ]
      },
      {
        "name": "List 2:Node 2",
        "labels": {
          "en": "Node 2"
        },
        "comments": {
          "en": "Comment N2"
        },
        "nodes": [
          {
            "name": "List 2:Node 2:subnode1",
            "labels": {
              "en": "subnode1"
            },
            "comments": {
              "en": "Comment N2.1"
            }
          }
        ]
      }
    ]
  },
  {
    "name": "list 3 id",
    "labels": {
      "en": "List 3"
    },
    "comments": {
      "en": "List 3"
    },
    "nodes": [
      {
        "name": "List 3:Node 1",
        "labels": {
          "en": "Node 1"
        },
        "nodes": [
          {
            "name": "sub1",
            "labels": {
              "en": "sub1"
            }
          }
        ]
      },
      {
        "name": "List 3:Node 2",
        "labels": {
          "en": "Node 2"
        }
      },
      {
        "name": "List 3:Node 3",
        "labels": {
          "en": "Node 3"
        },
        "nodes": [
          {
            "name": "List 3:Node 3:sub1",
            "labels": {
              "en": "sub1"
            }
          }
        ]
      },
      {
        "name": "Node 4",
        "labels": {
          "en": "Node 4"
        }
      }
    ]
  }
]